reading from file t_local.pcap, link-type EN10MB (Ethernet), snapshot length 262144
23:39:41.282171 IP 10.4.1.2.50768 > 10.4.1.5.http-alt: Flags [S], seq 2153793851, win 64240, options [mss 1460,sackOK,TS val 1406782453 ecr 0,nop,wscale 7], length 0
23:39:41.282190 IP 10.4.1.5.http-alt > 10.4.1.2.50768: Flags [S.], seq 66113077, ack 2153793852, win 65160, options [mss 1460,sackOK,TS val 1791873704 ecr 1406782453,nop,wscale 7], length 0
23:39:41.282516 IP 10.4.1.2.50768 > 10.4.1.5.http-alt: Flags [.], ack 1, win 502, options [nop,nop,TS val 1406782454 ecr 1791873704], length 0
23:39:41.282640 IP 10.4.1.2.50768 > 10.4.1.5.http-alt: Flags [P.], seq 1:129, ack 1, win 502, options [nop,nop,TS val 1406782454 ecr 1791873704], length 128: HTTP: GET / HTTP/1.1
23:39:41.282643 IP 10.4.1.5.http-alt > 10.4.1.2.50768: Flags [.], ack 129, win 509, options [nop,nop,TS val 1791873704 ecr 1406782454], length 0
23:39:41.282652 IP 10.4.1.5.44150 > 10.4.1.4.ssh: Flags [P.], seq 3667992915:3667993007, ack 339566844, win 501, options [nop,nop,TS val 4248993525 ecr 737846121], length 92
23:39:41.283080 IP 10.4.1.4.46696 > 10.4.1.3.http: Flags [S], seq 1847901565, win 64240, options [mss 1460,sackOK,TS val 4085760348 ecr 0,nop,wscale 7], length 0
23:39:41.283235 IP 10.4.1.3.http > 10.4.1.4.46696: Flags [S.], seq 1893377921, ack 1847901566, win 65160, options [mss 1460,sackOK,TS val 3244034758 ecr 4085760348,nop,wscale 7], length 0
23:39:41.283235 IP 10.4.1.4.46696 > 10.4.1.3.http: Flags [.], ack 1, win 502, options [nop,nop,TS val 4085760348 ecr 3244034758], length 0
23:39:41.283359 IP 10.4.1.4.ssh > 10.4.1.5.44150: Flags [P.], seq 1:45, ack 92, win 501, options [nop,nop,TS val 738286353 ecr 4248993525], length 44
23:39:41.283364 IP 10.4.1.5.44150 > 10.4.1.4.ssh: Flags [.], ack 45, win 501, options [nop,nop,TS val 4248993526 ecr 738286353], length 0
23:39:41.283417 IP 10.4.1.5.44150 > 10.4.1.4.ssh: Flags [P.], seq 92:256, ack 45, win 501, options [nop,nop,TS val 4248993526 ecr 738286353], length 164
23:39:41.283567 ARP, Request who-has 10.4.1.1 tell 10.4.1.3, length 46
23:39:41.283588 IP 10.4.1.4.46696 > 10.4.1.3.http: Flags [P.], seq 1:129, ack 1, win 502, options [nop,nop,TS val 4085760349 ecr 3244034758], length 128: HTTP: GET / HTTP/1.1
23:39:41.283638 IP 10.4.1.3.http > 10.4.1.4.46696: Flags [.], ack 129, win 509, options [nop,nop,TS val 3244034759 ecr 4085760349], length 0
23:39:41.327849 IP 10.4.1.4.ssh > 10.4.1.5.44150: Flags [.], ack 256, win 501, options [nop,nop,TS val 738286398 ecr 4248993526], length 0
23:39:42.306694 ARP, Request who-has 10.4.1.1 tell 10.4.1.3, length 46
23:39:43.330889 ARP, Request who-has 10.4.1.1 tell 10.4.1.3, length 46
23:39:44.354930 ARP, Request who-has 10.4.1.1 tell 10.4.1.3, length 46
23:39:45.378774 ARP, Request who-has 10.4.1.1 tell 10.4.1.3, length 46
23:39:46.402657 ARP, Request who-has 10.4.1.1 tell 10.4.1.3, length 46
23:39:46.459783 ARP, Request who-has 10.4.1.5 tell 10.4.1.4, length 46
23:39:46.459784 ARP, Request who-has 10.4.1.3 tell 10.4.1.4, length 46
23:39:46.459793 ARP, Reply 10.4.1.5 is-at 08:00:27:9a:71:12 (oui Unknown), length 28
23:39:46.459933 ARP, Reply 10.4.1.3 is-at 08:00:27:f3:af:49 (oui Unknown), length 46
23:39:46.502668 ARP, Request who-has 10.4.1.5 tell 10.4.1.2, length 46
23:39:46.502676 ARP, Reply 10.4.1.5 is-at 08:00:27:9a:71:12 (oui Unknown), length 28
23:39:46.507230 ARP, Request who-has 10.4.1.4 tell 10.4.1.5, length 28
23:39:46.507242 ARP, Request who-has 10.4.1.2 tell 10.4.1.5, length 28
23:39:46.507629 ARP, Reply 10.4.1.2 is-at 08:00:27:30:fe:25 (oui Unknown), length 46
23:39:46.507630 ARP, Reply 10.4.1.4 is-at 08:00:27:29:82:18 (oui Unknown), length 46
23:39:46.530797 ARP, Request who-has 10.4.1.4 tell 10.4.1.3, length 46
23:39:46.530922 ARP, Reply 10.4.1.4 is-at 08:00:27:29:82:18 (oui Unknown), length 46
23:39:47.426933 IP 10.4.1.3.http > 10.4.1.4.46696: Flags [P.], seq 1:41, ack 129, win 509, options [nop,nop,TS val 3244040902 ecr 4085760349], length 40: HTTP
23:39:47.426934 IP 10.4.1.3.http > 10.4.1.4.46696: Flags [F.], seq 41, ack 129, win 509, options [nop,nop,TS val 3244040902 ecr 4085760349], length 0
23:39:47.427114 IP 10.4.1.4.46696 > 10.4.1.3.http: Flags [.], ack 41, win 502, options [nop,nop,TS val 4085766492 ecr 3244040902], length 0
23:39:47.427372 IP 10.4.1.4.ssh > 10.4.1.5.44150: Flags [P.], seq 45:121, ack 256, win 501, options [nop,nop,TS val 738292497 ecr 4248993526], length 76
23:39:47.427462 IP 10.4.1.5.http-alt > 10.4.1.2.50768: Flags [P.], seq 1:41, ack 129, win 509, options [nop,nop,TS val 1791879849 ecr 1406782454], length 40: HTTP
23:39:47.427816 IP 10.4.1.2.50768 > 10.4.1.5.http-alt: Flags [.], ack 41, win 502, options [nop,nop,TS val 1406788599 ecr 1791879849], length 0
23:39:47.467864 IP 10.4.1.4.46696 > 10.4.1.3.http: Flags [.], ack 42, win 502, options [nop,nop,TS val 4085766533 ecr 3244040902], length 0
23:39:47.471304 IP 10.4.1.5.44150 > 10.4.1.4.ssh: Flags [.], ack 121, win 501, options [nop,nop,TS val 4248999714 ecr 738292497], length 0
23:39:47.471672 IP 10.4.1.4.ssh > 10.4.1.5.44150: Flags [P.], seq 121:157, ack 256, win 501, options [nop,nop,TS val 738292542 ecr 4248999714], length 36
23:39:47.471694 IP 10.4.1.5.44150 > 10.4.1.4.ssh: Flags [.], ack 157, win 501, options [nop,nop,TS val 4248999714 ecr 738292542], length 0
23:39:47.471842 IP 10.4.1.5.http-alt > 10.4.1.2.50768: Flags [F.], seq 41, ack 129, win 509, options [nop,nop,TS val 1791879893 ecr 1406788599], length 0
23:39:47.472417 IP 10.4.1.2.50768 > 10.4.1.5.http-alt: Flags [F.], seq 129, ack 42, win 502, options [nop,nop,TS val 1406788644 ecr 1791879893], length 0
23:39:47.472428 IP 10.4.1.5.http-alt > 10.4.1.2.50768: Flags [.], ack 130, win 509, options [nop,nop,TS val 1791879894 ecr 1406788644], length 0
23:39:47.472504 IP 10.4.1.5.44150 > 10.4.1.4.ssh: Flags [P.], seq 256:328, ack 157, win 501, options [nop,nop,TS val 4248999715 ecr 738292542], length 72
23:39:47.472646 IP 10.4.1.4.ssh > 10.4.1.5.44150: Flags [.], ack 328, win 501, options [nop,nop,TS val 738292543 ecr 4248999715], length 0
23:39:47.472756 IP 10.4.1.4.46696 > 10.4.1.3.http: Flags [F.], seq 129, ack 42, win 502, options [nop,nop,TS val 4085766538 ecr 3244040902], length 0
23:39:47.472976 IP 10.4.1.4.ssh > 10.4.1.5.44150: Flags [P.], seq 157:193, ack 328, win 501, options [nop,nop,TS val 738292543 ecr 4248999715], length 36
23:39:47.472976 IP 10.4.1.3.http > 10.4.1.4.46696: Flags [.], ack 130, win 509, options [nop,nop,TS val 3244040948 ecr 4085766538], length 0
23:39:47.515298 IP 10.4.1.5.44150 > 10.4.1.4.ssh: Flags [.], ack 193, win 501, options [nop,nop,TS val 4248999758 ecr 738292543], length 0

